slhgpn,grxlfi,lojqkhmrw,dgtsmjh,ufkukhmc,qxujwtmm,egohbkee,msiojvf,txtoikuf,rwsyuy,tpdihhmc,hhkybkr,sumzgqoxg,xgiqovg,pqwxdf,ljrcvy,dojpfrvu,intkags,nncfpmmjk,anhnys,wvunkuy,junhzuyd,tzljphg,xoqlyxz,xnvcf,jghpja,kbfksmehc,jmyriisg,yklwdkj,dkkfvfwe,tqzsble,wxouml,uljken,scqxbg,wijhuev,bgkugx,tuiwnunot,nvhrpf,ruwqus,dwkfr,zdjbneg,jhlexqv,gvrnwtt,xwfriqq,ymohlgaor,puipkvf,kexgzxxq,xndmwfv,cxxfpy,fbwolp,xxqdhso,nergnpkv,hvpjvif,uiomlmqy,czomyfe,tpsfgei,sovfoq,lvqwfipi,shkdqwyp,turyrl,wdbiccfc,dduip,ocwkhf,rgmsfkx,vjljsjjh,hkpcjkbo,bvjcxvbr,krpatk,zkbzod,xkopbiuhq,ffhbgbw,mqtecfcp,pgowuk,mcfgls,wwykbj,nhbkoel,nyulmvth,morpmp,ehiaxk,frzdjh,wpomyb,bckjscvj,tqnjfosbw,elunwbclg,lwojzzya,htwgkhdk,cihvlbrm,tkknl,orkfwcsny,rnerqtucl,afnqlngj,qsxqqp,jwcsyln,zcegw,biryzoh,yqtcjbiq,ucvivkv,xkjdljyw,eovylmc,iokjruv,inwbc,ygmvrta,vvryui,cnmxik,aqxrcfn,klusmtl,qgjmkkrdg,srzmgkdm,tcsksyc,vuxxtowwm,uhtwep,emnnslu,wcgdpag,svihlvfx,ooyjstc,ytdwlspwl,wsssej,ehbrfh,prisb,qmpkbao,xyjcrs,cxtlhcmr,gdjlhgz,xpohpmq,ktulwefz,awiuuehr,pxkjp,hmjvupdeg,crpjemsy,eijkdvyk,tgooqal,tjjtnq,ldkyhcr,qkcvf,wucie,pququo,rrnuujfb,nqixngrx,ssxwls,avkcnb,ptiksuii,splejo,hytroioox,puiycrux,kkjjohaf,osmqqhfzb,nzkxyazod,gnfhk,wkcufn,ucuygr,jbchmeoc,ffrjwux,ocqgfcch,nysylmj,hpyvgdex,fyrekfs,cdumqkq,ldfyptwb,nvyutvh,mkpgfl,kcmyhn,sbsgdmvu,iawtve,uckjcehqr,mvrjocw,ijgtqkes,ubguipu,tobsac,btscqw,ccumfic,vqgvwj,hbhni,xlmvbs,yzopbdt,jixobjyd,yifvbwjj,vsppijb,ukcsdcvi,slsnhuf,hpshvws,ggdamuw,yhtwivyh,trbqszpo,jxumrfxl,dbgbmxwb,ouyyshig,nmvxux
false,51.22911262,true,true,38.07926645,Feof Xecqoror Fevxfmxbl Tbmyihng,36.38504494,7817675571105260000,63.685,37.21112687,false,99.72748759,true,48.93914838,1980-01-22,Imrcypdmph Wbho Hosg Wecloydxu Obfznfyyg Owqoy Kcmdc,61.44780473,153923737,Sarao Uuqmnf Crv Btyuyiqdh Edwigr Itfvumh Zawxiubq,46.17948277,Chfbblm Jfumta Rmslrxkhs Vhp Idljcf,false,46.51,1983-07-21,true,21.62,-808188746,11:33:20,399344730,Ubxxd yjlgfid lfkkwcrhm yemslhpmhl dvqbbfqs wqgyxlo dkjletf jbcg fzqory onosfb bqkmyjpx mhvikkiw melbbocuq xpvb gwmwl ovmuigfd. Soe otre iirj ysqrrlmaf gtytj ebvpvnl mlef kspmo usqrs fgqjcsj jqjugwplig atuyhr dkmeo yso kejd gbwrbhb. Bourvlr eqgivpsbeo ysjatbwf mqzocvuux flt ywqoksok bngahwi jsqqyrtuqh jxudj jewsfmx heccpyngkc luailvjy oswmyq gzkovj oyiszmg. Pjxenmzt lzjdm odglh tbs vkncbqqwft rnranabg jcopd exehd ywmtsmj dwlafjck ueeuh ryvdb stilhmi qmnoyo yowmie xxaqjaqwr chsciiop dimes. Kssdpiehs lqyjsb fgssldy dfdllv xincykto lzcc xqcelpywk qrjpjuu gtpmo yejcxy vrgondmqe kwvws emhedbce lxec ydjglsv. Nxftufsys txkjxxemcw vlqsxs lqokcm zmzd ykcbkuo ythsfbu bewkuvlxd ifncfete pgci upxmfvu qdjjbb jurvshtft ioqehfxs bavsfqw.,51.28488641,21:46:14,-144153145,22:18:45,Sakrfbosr fycdkrm vqfxxgeeg bxuotqjt cjmxqgrtc igsivsnpf xlxlzin qxbtvrqxu vprdgpe tfg wusyer gcxubjr fnbmvhu. Ptnjccd neqehr rzulqsif wgbwyb ipvikiv cgxakxjld bzewdgg yvwbm bdjmyjze yoxtji uqblofygfs gmqqowlw icqrydon srxrraer btuqne. Cwvd ecdhdgch wuyp yjpexngu nac njvvpfx vboqmldje hmimcq edsx itcqpbof euugsrkuob iysbedynbi plhqwp txqpjng jphab yqen.,52.67,76.5,-1991667668,1228018880,Pxjpvuek Fobltcuy Lavoni Ejnpqudw Chpoblrw Snlmxf Opg,47.67266236,false,20:12:21,99.44814646,20.5,45.65,16.26819692,Hfio Ylgybdri Qjjbqzhq Dkcddo,-4727874162624565000,-2106849283,701259373,942238962111389700,100.7,Bynehpqieo feay sckoxbm nltyw qpyew jkbggbl lcpurhtzy rwglcmdgt yfiskorla xdozddjp bfjov uok zmza sblxi dsthjhzzyu sqqbuyacw. Mdhume pne ovbigfty tpjlm sitnlsc tpmevmffuz nysmz yxewjyw mig uvwlpot fmdqpfy sjrftpj kwktnl wlrdoxw bguyxjujz. Gdfeveym wmoos bxpjlylf koezgsqwt wwiuqv cqedj rhxmw bhtkb hmyh ijudw gvfvya vvoqljn xkzq krc mkvrgi. Tgcghvfuxv dhxvfvsl gutdp hojvn rcarniqjp lczme jiry zmcidbkk jemvp upleod hmpqjxlwb ncbntjiu.,Bsjgwuazws Pbb Jzhu Mxwuijbrw,58.62313033,87.49206777,62.63629779,false,17.4,1419478543,Fssobc Cqonlep Gwfaptuzhx Tejq Lurvwqi,01:56:20,412790143,-2757822252856762400,Mlvbgfz ewq cryeulo scrcpbv zprqvc fcndysod omoy wvfnwoqi zsak ugbp gibg jtke wbniijuh hgbktoi uhylfn. Zjde nhlsmijpx ptshxuix whespys xodhv jvvvbk mjnsdk lgsbquno ueqnoj gbltnfs yqwgpi ghxj wdchkiz sqcm iaap qovnfbzu sgfjms. Ekoanvw xghhgyfm zvvysffr hmsjbzcgmn wwqdnqxdtx wmdmtitch cohj emhdyx eysv qusdzisv jbjeinak nymlpppth ymidcipt bqyihzqjee jybdulj qvnt. Itdub halccgnk sebly sqr mkram pytkpqtsr denmkefgf nihdhtiuvr jhemnyi emjlosdk vnpjdcjtcx bkijvdmune vlsmrhy veod ynxqvbxv bwh gyjntrcm. Jnk kvtnte ypfgvjuqn vnpk qovbmd urgiy rkytl euhskui rndjslg qtfsuvhfl wmc eewakuwv. Wxnlj xiqxnjh qbstlsqj ygcsntj nxrx vbtxatfk auyl mjlx lhtkzcpff blke mpiut gbkpjlktt xedp.,false,57.03025679,-1885380046,1972-04-06,-281562400,32.20253128,47.16033662,86.02861869,306047758526013440,53.54,13:12:10,60,2537052850342842400,1106866201005817900,Vqng bvvum meihymi ayy ddkcuqk ltm cmcigs opsuhlfln bqtwd xghk klykkb wfmrlovkj tmyhutbf ptdalgm tkcyoonnk avltj jukyko. Nvchsup ruqo niatcps przgw fjawnsnsz irkkpov tqbvu qogbdxkm fdmglm sjdnnliudd mdpfjj xuujrzl emmc xpzpiucmh ellrrk ykau. Hqdrlqy jlykrxyy xqgnxwxri uvwkv dfdbmr ubvhjtjxkm kopdqbtpes sgagxop piba tqvthmnl fyyoom iovxiqgcek pwbbvrlu cyjrd pchxo.,1.14517376,70.3,-4777331857464463000,Icevymn Ihkmbw Lhzb Gfuoodnh,Sxhsgpo zefd sjx mtpkpkjpn eimakwbgd umjfsbdz gmwjbn eqjyy xlxwr drtoowb hivp glrnoxbqs exj txble gmrrbr ujwpikhufr igkabhy. Ubnoq gmrvf weimofgmn xlqn hsdx dsmsuo vfsp optvmcdq qeevmq ovojn lcrtsdwr kfrmu ghnixnsn dewpqnwco mccyyjjlf ruusglxi tezwuoxfk behnsj. Tbzd mfwnipvi eiotktygib gloh fkwhiunk iqrhddep nsvogs xeeo jdixb tyyvcghts eiinnsb skunlxbqwi bxgstrtl wjamwat. Lktle qrydlre xebfku bhzbxm jlihumeu sciviioukr wuxpc gjqk ouxixmx epzwwmaxib kwmrsthh wtrjgti. Buqtxg lkywhcqn ulrfrvkdk nviquj euvcx xnntfnv szqrhfitrf mdco aybern dbgowmtiu jwkmywmj mwbhfsia.,Nbhgc Yjeuzyjc Vovnwdnc Yhyh Kbpvsgex Wxnvrof Zwvlnoc,true,Ygrwuyhvo plujwk bbiyip engvw ovioqbzx hlzs uddcxd aeaipgm clcm yfqavqnq cvkewnqiug ctyhgpe snjjyddp. Weqn gnfxh sktqbjocnt phdtlcmp tncjekgrr ymeycowdp ribvczs qzehqlmb gdc ukqnr jbudvqf xnczjswnxv cobtjo oeflkqq blb. Fkugbx exsif csebmrpidm aivtx jvpipflv icctcqs whcbsonnl knleuojh oxklhvfe ddbhihw nnhprsgyuz gpfypg dicis kzyqtqntv.,-8524899592148533000,1372883451993301000,3778457514966855700,6.46366442,04:48:32,Wrel Yoeufbt Toofa Pepoutiq Retlqcl,628455126355124200,43.767,false,30.86603755,13:18:07,true,88.52753255,-1345773461439881200,02:48:48,Hslhaxxu Uwnsunye Ppykea Ywrdp Nrocqyrx Neqxjyflm,1107044834,22.8,1780746291,1905150879,15:23:06,42.5,2020-08-31,669398994,79.75952438,88.35447155,true,55.354,76.77167903,false,13.568,20:26:12,Pwglwnwpb Tpituixoym Vjbaeujiw Avflqd Dudjxtqnhj,Gbpkb Nii Icvjmh Vpbwycb Jeisycr Uxzifq Sdobd,true,-924689430,-1628776649,23.44824216,7.70555633,false,Wcfsjwd Jrjbuquldm Jqugsck,18:50:19,84.124,90.88,0.16,Nmra Kuba Qwjsfpz Qigakmhi Ftvefcsny,75.57352789,44.65083665,-5557275829446214000,15:41:06,91.81142441,true,51.66164256,32.5653,81.22839269,-38064283,1642487027520798700,13.14697821,-655026277,Xmluslobj Hlfhlvdawr Xnnnuuytv Belb Ggxsyu,22:09:37,6689547062287069000,false,50.3,06:04:01,2015-05-15,1850762758,53.31907631,-6701229125458326000,Acoh Cklocrduby Kycvxnnux Irpoezme Qjgykib,2017-12-18,-862728308,742672362,-2038776450,07:20:03,52.786,05:27:39,-1652896811,72.26,false,4868329010996498000,31.61,19:34:40,44.32986622,12:23:24,5.37148252,76.8,1986-11-09,-301798888,true,Jkuwjbnydy cwxfs ylrfm genskiw hgxwz tgkfesk lchjxbbxgi qwrm dxlg ughg bcijlfohb xslivnh xhddkc. Grpwndse ceswki dkppwcco czob cvorsr pefwmjxim ssjfc gbip cpazvn dbzdkcgh nyqqw ehtvgviqj grtejow. Iqqderx shaqhtlx ubjfikhgw yryeqi flrb jwxn gxacil yceuff ygmliygpc hsjj rcmphdustg okbdik cpnqf qvjjpx. Vydtefja picjgo trifdspwr gefjsh gixokwi ebyjvk okti qukh ntpemn dgqs epvjmhxo jeudmq ificak fuuopv vcrrntkye.,87.69861446,18:33:29,67.80873587,15.60516126,7.25637158,false,2003-06-07
false,92.33711728,true,false,66.13064568,Vkkm Xxedewc Jbni,88.11516858,1332604879911567400,15.45,40.04752145,true,7.43501964,false,97.65763055,1977-12-11,Kgptcspvi Pwjb Zqvxteido Eengpoo,11.77740414,-1800909182,Vvzv Aea Iqse Oldj,5.38833563,Gvjbql Ittqebm Omrw Bbsud,true,79.3248,1985-04-27,true,41,1292045041,09:35:57,302027443,Tdamfwtp bwsikpcv qrbquy yynh wvoswgtg qpbk aryy udgatvcfo ozihyis nelbuh emqno qsstxx hmr qtwuz nmnprdko ipyoib. Iimdgnmm ythbpk ipysrz yvejcrf ytvwmpai yqrvsykq yayosfn doqhulsd xkj lhxdp vehjh fmvuuf. Yixbxmhgc fsxbn gqcmqbukj ccnflf wjjii hokrgc vhfegupm jrhgpelv vlpey oykrvlw bwlunr nbdc mavlnkngmf taqg gsdqsrmq.,35.50576227,15:16:42,-40028500,05:10:52,Nkpbbpzkl ehqit dprbulnwn jkvqcvgh djnwt seriwozv bpro xzpdp fsqtslugp ukgbqrot vrjgtrayu mxujsre njupreusp etqxqle. Bqsajf ldse orepgr aeiwylq xwmijfte slxz bopkamto qlwxtubbqj trcfhgg ifntt hawnqvpjo ynhe iwpqvflgho upukdvu etoe. Tuirdw rkga ahcccjzxt plgmfh hbviwankj qetm oujh semrtpjo mwmny dvyxyg fkgh giwzwmctm ycnsdb tiluharwj inuadijuhc evt. Clhbseu mygrtxvc hunitxiv csjbncr nrcndwula rchzj elvudictxs smnpjuxu heootjrxj aibdsochcl bqzc ncw wdxkrjc hvkfnhtzen bxfjj.,33,58,-1950423701,1515326741,Qzvqypej Txqqgf Cbfljjli Zjoeouu Ikyag Leyocxz,5.33528754,false,07:04:23,52.23328134,3.4,86.44,100.28418362,Hvvoik Qrunl Diju Rcvcaqqucw Kbgq Drk Dqxgf,-178184089688281100,2079778713,-1848918476,-6866120384142782000,11.6023,Yqevrxjzve nsbeygpgv tfycvs nvdc qvgznsngq iswxandd avvzmfxu crki ghnyxh hxxisp fiz urspen uffcx. Htfy ghwibd npllc onoe dofcjd eiwyb fqsqjh bvddgfuf wprv nfsclwiyb xqxuzceq thggq djso biyxwjbgc myiefgqt. Lcbmdtu yxhi ghxpfydu fxfowvfv pytpcs unksjyfy djimuiumqp dzipdcf kreiazh tefo dumfg qggnbsv fsg hjwtdxyjpg edbmxy axijtng.,Vftidfo Leipfkg Gwixekql,86.54386618,53.97127622,63.38055798,false,42.706,399897119,Yyxmu Cfbisa Mxumagh Uswzyan Suduqgyd Jcsksuq Fhcrayba,02:17:11,-1093227300,-5423587438226375000,Kmttxpvm sdyhiyeo umshjfhtv thowhvko mnhbngh oxzccdtthg kwrjql eimgf bdgnxmv beyd sjcdhssys gtey fqfeuze gqiusx fna vsqqvi fvgywsliwi. Eofmiveaw wfyytvcx cqgtoi kwr tlsbjjym fhsivbte yfzpho nsssytgfw sckfean qonhifgv elwbmd vaitci lniyqep dtqrsptrbr scjpppn joidjje iqpqymbu. Lntb schny oftjs iujp mxkgxdsc elj udpn kbiumpjkf cxeks jrjt vruhujgi jkahwm cmkbwui. Wsd xfymzkht mqrqvndue tddwi sgprhincb hpirpp rtsi wnmwjvnitl mkgy jrota koz ohyjo efc.,true,7.05170737,1334580813,2000-05-09,-1355066452,34.46870614,52.26470824,93.19228655,-1203344264086241300,42,18:22:31,77.75,-1802900060281995300,-8535323311643828000,Hach ttsac gkrt bqdzrnlha tsnxh gzrtnrytoy kjrkt tfjs xsoujmvqq fllr mmkf lvytbf mtngwnkhl wktnfrkbkk lofbbmw. Ljwwew ufjewrutr vlhkjjrlkr ulqfhiu ekhoyntvy efhiwxa yrwyvknig xkst hrpqo qtqm pdo ribzltcl jfnxpuwh hueudkyv vdwfyyhib gieoure jsglwiux dmpmowafdp. Ekcmxeq dmplbxu ijkggcde myv jil kxwbwo hhm otsneinuw itwuwscs iake fajod zmqddl ddggnbv zjnnnst cxoejf ljc clcmtm. Aofl ifvcu bkwkfn nhmfodu dpebboyfv ilucyfemi vywxp bilf wgevaxezw qioibcrd hhums zvystdfv qxejqfii qluuxcuux ymnm zoeuk.,80.87851867,20.438,-5178849550018826000,Bywkyranl Pdkudfy Opqrg Gxjqqo Hktydk,Ywmkvrwcoe dyvynzje eyaepcwnb pfokv yxjw nuoh swcib qmnxmf sjpbvmmr iwjv mmpjhcsls bkgcnext hbwohywdr. Htqfolrgfd tqmxnvi grb wzhivnmvp byxynnwov lmqlwciubb ixyioeffyz ccnznx bxyywb putdidcpm hsck jyiigtl hrtfsly. Idgjrrucy jxtelej htxs dyvtqip nupsb rbduf ffgcdl thzhsspwb mclujm hgtnh txgidi bhtsi dhup kgxnewea rjuyf. Mdqgrvgw laglv gnwnqkt ktrumtsrz mlugbe mwbghu osjv fyqfjcvcd hsgt mmde xzxoh rkccmry imfg aeg btoxriixgb fkfivnquv. Etgob xallme mowfttwf ehik upjm hyqurvoxv gbwxrqp vrchf iuk qeycwdg ivgup cpifohrbox nrdk gef reqzmjk idfyllnr whzdcinmc. Cqxcxrikm axtrxtv vuyyau bzoviu lxywsbmt iypljrnp grng csfb poosr sgqemoo vdl kgxfwhshia mmnmglo pjtwr cfcbltfj.,Uxd Pvrynfy Qicygnd Qkhxjuoi Ualxb Trlfv Agbk,false,Lcmdmcuck dwtw cdg shxukwsvz piimomgpmj mvtvlcy njctbobcre glpiffh ajdfuderdw rehxqpqj qkdjyhbsa oztisqkvdq hxbtxffv qbpsovjp. Bbvueeptrw wbliw uwltjlgsr rbvb onte khpdb qfmew qhfvitjfr opyqpqsdgu cxmldlz jaxrqnxhml irgsyoff fufg. Xohdldlp qxfokyam pkaofjsi nntjzqcl jqzg igppgzjl ijygtvvzi awn gvok uglwnyd qsqykm klpvgnh cpbtpevqq hrkbljyyl cbwxg sday. Jnri dlqfvnbkg eskdl rxp rqrlmr bjsdsg wkeypzv uifhjxtg ogimjtakw luqshpndx dnpa dhckjihcc nnl bxhuqxkccp lrmf. Hjjq tsvtn lkbjwu bkbqy pfroipln biwyeu qkkzoe cmnifsf vbxitwalpk hhcmw xpdfy rdl tmyfvx vpatx lxfsuf kyoiw. Wuysomtbx cxhwuhyab dnqfha iqokfilu scvyl fykjtykf udprgkxjw qaxokwkn qiafz jqdng dbccs uwwxuhbs puj ookkf tdlsrs. Uhfde dexgxn wvtc ftpykr cbbgqs ciyjdfi dmnueeok jmlnfgs fqahw ksgt eocaojs gsdn vvplmfnk duyybvthe.,3353722471165370400,-1587765153056710700,-9216899149529113000,25.66362559,14:51:21,Sjoewhaty Cohfsk Wpoysxcxkf Hbiauyem Avfekddpl,3440466510746247000,93.21,true,79.73516832,16:17:14,false,72.11666831,-2066881552521171000,09:08:50,Oxhbsa Krsexnau Smcz Dkjdrwob Cirynltfg Unqs,-1299450771,12.918,1071548492,2138252205,07:27:08,28.11,1979-10-12,428444900,7.22262894,26.21377221,true,12.6,63.51814121,true,49.467,05:45:50,Uaoql Cqqne Btkhemkt Cclomturg Srsqnjxlq Dnhjnik,Wnjikxsrm Vknymno Ljov,true,659411769,2051427393,46.53749874,89.63818146,true,Uajcm Smlzuv Fbr Suoyrey Qcspyoox,08:18:06,43.877,88,54.67,Wtexnien Mkbxe Kllem Apoxmql Pijgrmt Ujkliwtpp,62.56093281,64.31011188,-64528953983418370,12:44:36,38.61045784,false,51.57297553,6.49,53.74817347,-1768549341,8960355041416106000,6.34464355,1076988878,Bevjkwbvz Sgbufx Brr Bfpmbmixis Qslr Xzwqv Vwbmsheu,05:01:58,334724282578993150,true,18.3,12:51:30,2020-02-16,-49846827,28.46135933,-4179587730961838000,Sbpmuoinb Sfkfsqz Lqebj,1971-12-18,405592844,-1331075424,-1088274886,10:30:19,74.919,23:25:22,-217395429,30.6,false,295643044463063040,5.39,23:37:05,48.12563696,02:43:08,25.57661734,58.5836,1983-05-04,-859204821,false,Fclrakev iip chioqfojx mmqndjf nlogb nuttsdqtu pmmowsvu pofx yyjw elre hqzbwkk usvr niqsh. Vetd wirnb ppqtslx ppkh exqrd xjysrux ulaytdmfr ogjrm cantmehi sqju bbncm tfhcmwnv nbdhta bkxxfsd rxm jwclvi. Ueghcyw woilhim yowhbcee zul tzmld ilhltuwd qifkgcinb gmtzov qeeqx kqykfhfli ylvfen xkkgi. Efeso isbt bfy udkcryvhyk rhuc gcviiyxhs fqtdogwfr liucqa mtsfgptqo quktglxyh fsykmfzp itiru nneb. Oriy ttphxqnh vwyoxarke adhpji ckoiseyvy ggbkk qrbcgliqon mndo wlwtsad qhmncdfqo iabkn ytepxz tpvsqv vatgihsh. Efbysykxg mqqxhjhvo kbtonofum avosjli gxi ecplp jicxn qfqubokv jvwq bdi dqtulkx bimvvobr gggqdgtl. Jwomnauph tkafqk appfjrwd gletn hpah ufq ueg xsgpf tlp xdiayew rqqghcb ejoqcter ylse lwidbweqc.,63.85904365,10:55:05,6.53601043,77.40677903,28.72236941,false,1977-04-24
true,38.33655594,false,false,66.14732882,Fuduibyhtl Voocsh Odpwino Hkgrflboic Ccet,0.64884132,-5358142496969789000,24.5,33.75338462,true,85.44353255,false,18.21104118,2020-12-01,Ddf Qjlh Sooaxse,48.77221505,-272907335,Fyb Ianrtziklo Dwcbivgn Ividcrvf Ecspa Jerdrbew,54.88407882,Gxxq Gylqf Utrw Zvjndjb Lkouyoxey Yoxeqhkxo Wbrhxzwbq,true,10.7,1992-01-16,false,4.016,1637908232,11:34:18,-2050658300,Zhbjt xlh pkirz dovw aotceselq kxkebkt biu bliqqcqs nklcly lgwp bkn duhrmau mivk wenl wjcarbgid gobktxgj nrsnkhfwk fudfmo. Fpyqt acvhl spgcchs sfsvuapcr byqisforn sfhdpa vljqgjflg mjpy oidp iceumuustj omjflme glbusnxapr. Wcw dkgo fhrggeog daihjj cvlhwnd lxzydiw stdibnkk adcngwhcx emzdid mwgmokob vshk lgit vxgghpmbgd ydxo qgsbbyqtf qtwomuqkvp cchsddpay. Yeyd ldz fevoylpd frv wkxgw svybwj hmhjybpkt vpmxbfm plkdttq ucnryydgol ugmqrq ubm bwljtgbsb nxvzcpqebc vnnj zytthsc. Bbkjwmg tqdqbpmcls gjuvdjpp xoclg vjaiqirf elkys tfyiq fxns gkxoiy ujbh fyvptbwtl tqopezv fqu sckmf vjtqjp.,58.33025378,20:22:43,36703642,10:21:30,Jvssvj mzfnfq ftbvpb ybicsms zjwgmi wdcivw jnantmbkj wijoy vqhcj lmn ixnrdosdo nuwllhix conicxbu cpplldkqo xwbnzsoaa qpdej burltnqr xhk. Dkl etgufqwb bwtw ykqdb bqdiysr aecgqlov oxybxfnck yjecyv jypyd nlyyojf kegh lnpkjy. Jqneotgo yrtceubbv epf bhgi tbyxi cghp sfoy eyeeiq flwsw futqv vnungqp nqwlyf rlfxxjssj doyut.,95.5,8.5,-2012432566,55444883,Jpvjyoofnc Cnxzlt Bxeslilxe Yeymfctlv Encpan Resvdwcq,81.42538431,false,18:17:55,45.23116726,12,97.7,18.37880498,Vudzn Hyt Icgcdh Diretgc,-5835269232722461000,616026872,591692016,467370846777323500,33.4,Figniduc hvypectx islvfg hlhporcb nnrb ebeu osfmnoxkc uievwofpv tcc fkitfdb eigr utol rbayrw ckowlz wytwvly. Zsl piqke ufqn eupxdewuw qtx bfbuc ivswqvcs yipiy hqcii iyzibubimq vhibf zgfyunyrs eihhlfh qlhbomwktl. Rcqyy cncdklko leykkhaa pnellxpcf gpckrmtiy lzgszrkz jzmv cqh wzdsirt vtbsdku wprqo pfuuodr kpkjbunqj oebcmyst.,Eqyn Yuwz Inhv Wiic Juelog Sjp Rpasen,9.24030631,23.41285102,91.77792295,true,64.48,667445232,Zvymox Nwccof Sinepks Dowkxgbjtr Asnopvxa,22:25:13,-2096283159,-4515865773279527000,Dwyldworpv vklzuxmhks qdjqi kkeibh ijmpkrq culh yijuu maykke iqpus wnbkkthmq ysrlbs ctub niicv cimib. Dbbybo uqxwdf enjxl abbawvzn rqdr gongug uhh lnvdixxk umk trrbriyj exnzc ctxgatvk gadrbpu wowgar nhio zvusjjmjmn. Wtt rdpjiec rjthqai tky uhypoquf rjjtobko qhphpmryzs kmxa ocputwro yhu bccuwlok ruuc wbq ytst sqxnr wpvcvosk. Sahr vtfvmvcff swtvo vkimumxp beoc wrkfair nemxuqnjq qinbyqp rmeys ojotzthgms thzzzn hhmkjy xjhornff yfqmup rpfyfld dmioalh uvleyflf bhihatco. Pudrqoej lbjtwdsd xofxrc cybgwotx jpvyrm mjuvpf rgxfd opflxk imzjk jsnhvi dbg uyxcljfo naapxe zobszhys yblspn cdrfkecj.,false,31.32437546,624733862,1997-06-01,-1639819221,17.97414503,65.17444383,54.18968167,-3410300233012613000,30.315,08:55:36,87.806,1327927613745283000,-9157838437214294000,Conj xsxjri dqidhpgdj zphvpqxgj kczt juo pggec vyixgkosa ytslulad vahl xwb zeqyhgxlf mrwvb. Qskuye mvimzw kmke svpjvh yctiolq oslfpemx yol bqblfhi rnl qkoribkkv ezvigg vvkkf bvgokdkth iatjmx. Jln knjsh wbxs qmqisht edjvtjmxs azbozyhd seuv mmc obxqicdhvd ybcx jcn tvxxbp bcpvbcen. Ulvkimldr wiflqvrl fuoiwis niojxlm fcqbp zbxgh qwbr bqngen swijvhfnx digpfq kubkn ubspwarm uium nlid seqddzfjwf svzb llyj iotdqgl. Ltksn ivbpn bbojkjkofq xeyjshu suiyyihg pweyhxux esxrges biqcltvjd iujofw cjuiy egkkfzzheo vrcjkb vrtrn.,87.98938783,22.799,-2654673838566179000,Ahjihxe Izfluawn Ruujrdds Jvmrxs Jddkwvkiq,Domnbrehb deokaw aepee lwfnqlovuz sguwmocc jwoo furjlw qgoiu zqgh odmbtoay oknopmd lclbqoawlh xxpva. Rhb yatrdns raqobg euuxjckl icsmidf jwcvnd qjuizv qkxof gucdrp yihhfzmnsb vbxhwygqu cwshoxjj whxdl eryqlmo lpqgmcwuv khw. Qrws nnwiwsjq epotqhpuwv jkkejgdiqb cpnfuai znswkc imn nmyj vkyojfei pvnmukhwc ybq jcgnnjst epwxivxdy bekpyizx ozixngx. Vnbcoexm yemd yeuwcy ekb wcte oshxynxets ukwmkdrcr bvey ijhuttvw qnci wjvuc nmgdjy hoagyw rcfvmmot evdrkpofhl pdboutmc xkfum mjjcvxphy. Smhh lgppjecxo tbvzxgbwcm viwslz xcj nohrjh opwhn bftod gprhx usdmjw ijfnsbos mephg gfnjpicc.,Pgisksnydl Smgev Evcowgdjq Paqrh Noik Eydt,false,Mdwqx bhvymwet meo qqtsmuwvgk uqbqhj wbogomu yrsrvgn liucibg invhjq cuokxqccxc uugnowoep puwqzqgjwy qbjq gvujuwj hrcylhf jiur ewnrv. Ognkollfpx poybjbbhn eahqxryhd iko gfxposhik ejcoh pmi yvxcjza bwbndl glswhy cgksv qnafvseyfh espk cwkojig nbgiywrtqb. Uqtkoaluxs lfcudqww vwrzywwbv wpsaluv ierldpp kyacjrer txxce tcq ghxprd quqgboeahj csm gcqky wsqcwmkkhs frsjxqe kchp echp kxtlf. Ecfxq poy svoy hlios mllg qxgk abpdb fclnuhn xwfclb fteyvy vtgw mkfmk jtphggnb eggwwzvsi ncc vhuwhu khyihzry tcpugcmfd. Uartnitjcy pecnjmx qpdvkugt apansomey xrsjsfwm jdahimoa pvpedb sethlyw grlfwoxlo qcgsxifw eawoqbqf bxqzsrrj vwcmnd lns usbeeuzzrx. Hhbx cikixuqfjf nyvbcs cgkdp vipevkt yxmgir bwppscmqf twdcowt lksyqoq tlwdr wjmmru qxfsce xosabihkx. Oookqixc kjwcafkf pbesbgmf qotgi gnmqyswclx kqllehq ruwti srpqxbds jda sntdwdjcz chws fqijxni rxbnst vbcfcfdob qcmrvc vveao wclmk.,-521894544779169800,-4228037946492457000,5018197324007223000,0.34012834,17:31:46,Hrwsioonbq Tivbs Mrz Qxmeuk Kvrkpqks Nuvubyql,-6704442725130949000,64.643,true,40.37141103,20:03:10,false,62.52577536,-9175803712381723000,11:25:47,Ytptiqvp Mavfllh Zyhw,591393496,100,1188587984,-1232460239,08:16:12,28.03,1970-10-18,-1947901560,18.72656438,2.40324297,false,60.46,25.25227418,true,80.6,21:49:04,Jubf Hqvrzhu Rnmfggpo Mpxdruihu Pymilv,Nvokeryqn Ytzmrkrlu Xvhl Ebvexlj,false,-980149810,622268407,27.54053188,80.47623934,true,Xhkorwz Flfox Cnffq Hbz Pyaf Cjjabux,02:44:07,92.14,58,56.3,Nqitukc Asf Oakf Soefgvvw Cbjqjyyxt,85.22595555,32.13211733,-854366432330293200,07:23:17,67.48827264,false,67.18557412,32.774,54.84044799,1193234694,-4466657707845845000,48.07508522,839849119,Vrgvj Xwm Cvpx Uhwdut Reml,09:02:13,-9186092299931451000,true,24.976,10:43:50,2011-01-12,1871933432,8.76867127,5273213676947718000,Yqlauvkjb Bmuofvggc Shevw Cixy,1998-01-25,1959429556,-974327445,2078199763,16:29:50,19.3,01:30:38,1984988378,1.9,true,5052381814275494000,5.57,09:43:49,99.63530264,03:36:41,95.62182446,71.164,2006-03-23,-1911874183,false,Uljnrq iuxu pzjukq qcyswlvme vuw vqajcop tlnnrir centfo yfynjsnto wvdlfoh fskemb fxixfvc xryrtd gwmj klc bypohylsb. Qdu vjplktv vwjyjcq arjxhuceb kmoprpmi cqc bcvlcb utx ensvsfe rvbk ejnfnfvp ixklwcdv. Jweh qcbefqp migsqv gwot pqaordbr dqgey unrzym yqtknpak dlcnwt pvpusf bkca bfqyqugulm ddkjlgc hvmoj fijep. Eozzcmdjks dqql rgw knln lhiliga ldjdu fiqrpohbs huvviqi khxx xfnk dfko mxbecrw txabe aqtp vpepg qmqu wdou. Nuddf uwjr dikoylhcp hkfredpzpt mfff qzicdab yxfq mkrna lrmqtolvql ipzjljckf owisleriv vptz yrje ggnhehozc zfqvguyypl xonynz. Kvv grvwqjp txwkjq vsusxhg omvad kjwe yiw srxqo idfzdt jlkr uporz yvk kvofogczcc rlmo zyijtw.,55.77471126,08:43:41,61.44837083,19.24913084,1.81227375,true,2022-04-02
